,source,title,desc,when,location
0,Emelin Theater,Judy Gold,Two-time Emmy Award winner Judy Gold brings her sharp wit and unfiltered humor to the stage.,"Sep 18, 2025",Emelin Theater
1,Emelin Theater,Bostyx - The Ultimate Tribute to Boston and Styx,Boston and Styx’s greatest hits brought to life with pitch-perfect energy.,"Oct 03, 2025",Emelin Theater
2,Emelin Theater,Hilary Kole and Birdland Big Band,Celebrated jazz vocalist and Birdland Big Band pay homage to Ella Fitzgerald and the jazz greats,"Oct 04, 2025",Emelin Theater
3,Emelin Theater,The Linda Ronstadt Experience,American Idol Star Tristan McIntosh creates a stunning portrayal of Linda Ronstadt in the prime of her career.,"Oct 10, 2025",Emelin Theater
4,Emelin Theater,Ladies of Laughter,"Award-winning comics Katie Hannigan, Veronica Mosey & Regina DeCicco, bring the comedy to the stage.","Oct 11, 2025",Emelin Theater
5,Emelin Theater,Ailey II,"For 50+ years, Ailey II has brought rising dancers and choreographers together in bold, world-class performances.","Oct 12, 2025",Emelin Theater
6,Emelin Theater,Naturally 7,Naturally 7: the world’s premier vocal play group turns voices into instruments.,"Oct 17, 2025",Emelin Theater
7,Emelin Theater,Fearless - The Taylor Swift Experience,Experience every era of Taylor Swift’s music in one unforgettable night with the ultimate live tribute show.,"Oct 19, 2025",Emelin Theater
8,Emelin Theater,Don't Let the Pigeon Drive the Bus! The Musical!,"#1 New York Times best-selling, Caldecott Honor award-winning “Pigeon” picture books by Mo Willems come to life on stage!","Oct 26, 2025",Emelin Theater
9,Emelin Theater,Crystal Ship: The Doors Experience,Crystal Ship brings the raw energy of Jim Morrison to life in a powerful Doors tribute packed with hits & vintage rock vibes.,"Nov 01, 2025",Emelin Theater
10,Emelin Theater,Devonte Magic,Mind-blowing magic and mentalism from a world-class performer.,"Nov 08, 2025",Emelin Theater
11,Emelin Theater,An Evening with Jim Messina,"Jim Messina performs his hits from Buffalo Springfield, Poco, and Loggins & Messina.","Nov 15, 2025",Emelin Theater
12,Emelin Theater,Brad Upton,"Clean, smart comedy from a viral sensation with timeless appeal.","Nov 22, 2025",Emelin Theater
13,Emelin Theater,Storm Large: Holiday Ordeal,"Keep the kids home, and blend holiday classics with rock and cabaret for an unforgettable night.","Dec 05, 2025",Emelin Theater
14,Emelin Theater,Koo Koo,"Sesame Street meets the Beastie Boys in this hilarious, interactive kids' concert that will be a guaranteed blast.","Dec 06, 2025",Emelin Theater
15,Emelin Theater,The Martin Sexton Abbey Road Show,Martin Sexton returns and reimagines The Beatles’ Abbey Road with soul and passion.,"Dec 06, 2025",Emelin Theater
16,Emelin Theater,Isle of Klezbos,"The soulful, fun-loving powerhouse all women's sextet fuses klezmer tradition with jazz, swing, and global influences.","Dec 07, 2025",Emelin Theater
17,Emelin Theater,"Click, Clack, Moo",A quirky and hilarious farmyard musical.,"Jan 25, 2026",Emelin Theater
18,Emelin Theater,Doktor Kaboom! Look Out! Science is Coming!,STEM meets comedy in this explosive science show that has kids and adults laughing and learning together.,"Feb 01, 2026",Emelin Theater
19,Emelin Theater,John Pizzarelli Trio,"World-renowned jazz guitarist and singer, blending old-school charm with modern flair","Feb 07, 2026",Emelin Theater
20,Emelin Theater,The Stinky Cheese Man & Other Fairly Stupid Tales,"Classic fairy tales get a silly makeover in this fast-paced, family-friendly show full of laughs and surprises.​","Mar 01, 2026",Emelin Theater
21,Emelin Theater,Cat Kid Comic Club: the Musical,"Frogs, comics, and chaos! Cat Kid Comic Club: The Musical is a laugh-out-loud adventure for the whole family.","Apr 12, 2026",Emelin Theater
22,Emelin Theater,Ann Hampton Callaway,"Tony-winner brings soul, style, and songbook classics to life in a night of unforgettable jazz and vocal artistry.","Apr 24, 2026",Emelin Theater
23,Emelin Theater,The Pout-Pout Fish,An underwater musical adventure where Mr. Fish discovers the power of positivity and friendship.,"May 02, 2026",Emelin Theater
24,Larchmont Public Library,2025 Adult Summer Reading Game: The Many Colors of Books Bingo,Now through August 29th.,All Day 6/27 - 8/29,
25,Larchmont Public Library,Children's Summer Reading Game: Get a Clue!,"2025's Summer Reading theme is ""Get A Clue!"". All things mystery, mysterious, puzzles, riddles, scavenger hunts, buried treasures, unexplained events, heists, and more!",All Day 6/27 - 8/29,
26,Larchmont Public Library,Teen Summer Reading Game,Students entering grades 6 - 12 in the fall,All Day 6/27 - 8/29,
27,Larchmont Public Library,2nd Annual Children's Room Mini Art Show,On view in the Children's Room from July 11- August 22,All Day 7/11 - 8/22,
28,Larchmont Public Library,"""An Artists Journey"" by Lila Rose",Reception: Sat. August 2nd from 2-4pm,All Day 8/2 - 8/29,The Oresman Gallery
29,Larchmont Public Library,Take & Make: Book Page Flowers,"We’ll provide pages from a discarded book, plus a few additional materials.  Follow our simple instructions and you’ll create a beautiful work of art!",08/15/2025 @ 9:00am to 08/31/2025 @ 5:00pm,Online
30,Larchmont Public Library,Wet & Wild!,Let the wild rumpus start! Join us outside for bubbles big & small and sensory play with water!*This is an unstructured playtime event for Toddlers & their Caregivers**Weat...,"Monday, August 18, 2025 at 11:00am - 11:30am",Ryder's Children's Garden
31,Larchmont Public Library,Open Play Mahjong and Canasta,Come to the library to play Mahjong and/or Canasta!,"Monday, August 18, 2025 at 12:00pm - 1:30pm",The Michael P. Coords Activity Room
32,Larchmont Public Library,LEGO Free Play,"Come to the library and see what you can create from our library LEGO collection.

*This is a drop-in, self-guided program, please clean up when you are finished playing*","Monday, August 18, 2025 at 2:30pm - 4:30pm",The Michael P. Coords Activity Room
33,Larchmont Public Library,Project Linus: Knitting and Crochet Group,"Come join our weekly knitting and crocheting group and help make security blankets for children who need a little comfort.  We donate to Hospitals, Day Care Centers, Food Banks (such as L/M Food Pantry), and other places where there are child","Tuesday, August 19, 2025 at 10:00am - 12:00pm",The Michael P. Coords Activity Room
34,Larchmont Public Library,Diamond Painting,Relax as you create a beautiful mandala by affixing tiny colored gems to a self-adhesive canvas.  It’s like paint-by-number with rhinestones!,"Tuesday, August 19, 2025 at 12:00pm - 5:00pm",The Loft
35,Larchmont Public Library,Drop-in Wand Workshop,"Calling all magicians, wizards, fairies, and witches! Are you in need of a new magic wand? Come make one at the Drop-in Wand Workshop!","Tuesday, August 19, 2025 at 3:00pm - 4:30pm",The Michael P. Coords Activity Room
36,Larchmont Public Library,Historical Miniatures War Game,"The Battle of Stamford Bridge in 1066. Hearing of a Danish invasion to the north, Brit Harold Godwinson marched 190 miles from London in just 4 days, collecting additional troops along the way and catching the Danes unawares.","Tuesday, August 19, 2025 at 5:00pm - 7:00pm",The Michael P. Coords Activity Room
37,Larchmont Public Library,Young & Restless - TICKET REQUIRED,"Explore the world of literacy with librarian Erin! She'll have themed songs, rhymes and books for your little ones to sing and clap to!

AGES 0-3","Wednesday, August 20, 2025 at 10:00am - 10:30am",The Michael P. Coords Activity Room
38,Larchmont Public Library,Secret Agent Training Ages 3-7,REGISTRATION REQUIRED,"Wednesday, August 20, 2025 at 3:30pm - 4:30pm",The Michael P. Coords Activity Room
39,Larchmont Public Library,Secret Agent Training,"Junior agents will be put to the challenge dodging lasers, identifying suspects, creating masterful disguises, cracking codes, & more!  Put your skills to the test!","Thursday, August 21, 2025 at 3:45pm - 4:30pm",The Michael P. Coords Activity Room
40,Larchmont Public Library,Block & Roll,"Meet and make toddler friends during this unstructured playtime full of blocks, balls, and stacking toys! Even a play kitchen! *This is a drop-in, self-guided program, please ...","Friday, August 22, 2025 at 10:00am - 11:00am",The Michael P. Coords Activity Room
41,Larchmont Public Library,Yoga with Franklin Shire in Constitution Park (weather permitting),"All levels welcome.  Bring your own mat.  Franklin Shire is a certified Kripalu Yoga Instructor, teaching in Westchester since 2007.  His classes are gentle to moderate, a breath based meditative practice of patient self-awaren","Friday, August 22, 2025 at 10:00am - 11:00am",
42,Larchmont Public Library,Friday Flicks!,Escape the heat and enjoy some fun family films!,"Friday, August 22, 2025 at 2:30pm - 4:30pm",The Michael P. Coords Activity Room
43,Larchmont Public Library,QiGONG with Steve Goldstein in Constitution Park (weather Permitting),Join certified QiGong teacher Steve Goldstein and learn about the ancient Chinese form of gentle exercise composed of movements that are repeated a number of times and can be performed by just about anyone.,"Saturday, August 23, 2025 at 10:15am - 11:00am",
44,Larchmont Public Library,Saturday Afternoon Open Play Chess,Join us for a Saturday afternoon game of chess. Chess pieces are provided.,"Saturday, August 23, 2025 at 1:30pm - 4:30pm",Main Floor Conference Room
45,Larchmont Public Library,Library Closed,,All Day,
46,Larchmont Public Library,CANCELLED-Wet & Wild!,Let the wild rumpus start! Join us outside for bubbles big & small and sensory play with water!*This is an unstructured playtime event for Toddlers & their Caregivers**Weat...,"Monday, August 25, 2025 at 11:00am - 11:30am",Ryder's Children's Garden
47,Larchmont Public Library,CANCELLED- LEGO Free Play,"Come to the library and see what you can create from our library LEGO collection.

*This is a drop-in, self-guided program, please clean up when you are finished playing*","Monday, August 25, 2025 at 2:30pm - 4:30pm",The Michael P. Coords Activity Room
48,Sheldrake Environmental Center,August Mini-Camp in Nature - Week of 8/18,August Mini-Camp in Nature - Week of 8/18,"Aug 18  -  21, 2025, 9:30 am - 12:30 pm","Sheldrake, NY, "
49,Sheldrake Environmental Center,August Mini-Camp in Nature - Week of 8/25,August Mini-Camp in Nature - Week of 8/25,"Aug 25  -  28, 2025, 9:30 am - 12:30 pm","Sheldrake, NY, "
50,Sheldrake Environmental Center,Gentle Forest Bathing,Gentle Forest Bathing,"September 12, 2025","Sheldrake, NY, "
51,Sheldrake Environmental Center,Back-to-School Family Fun Walk,Back-to-School Family Fun Walk,"September 13, 2025","Sheldrake, NY, "
52,Sheldrake Environmental Center,Restorative Yoga + Mandalas: Resetting for the School Year,Restorative Yoga + Mandalas: Resetting for the School Year,"September 17, 2025","Sheldrake, NY, "
53,Sheldrake Environmental Center,Forest Friends - Fall Mondays,Forest Friends - Fall Mondays,"Sep 22  -  Dec 8, 2025, 3:45 pm - 4:45 pm","Sheldrake, NY, "
54,Sheldrake Environmental Center,Nature Detectives - Fall Mondays,Nature Detectives - Fall Mondays,"Sep 22  -  Dec 8, 2025, 3:45 pm - 4:45 pm","Sheldrake, NY, "
55,Sheldrake Environmental Center,Little Sprouts - Fall Fun,Little Sprouts - Fall Fun,"Sep 25  -  Nov 20, 2025, 10:00 am - 11:00 am","Sheldrake, NY, "
56,Sheldrake Environmental Center,Forest Friends - Fall Thursdays,Forest Friends - Fall Thursdays,"Sep 25  -  Dec 11, 2025, 3:45 pm - 4:45 pm","Sheldrake, NY, "
57,Sheldrake Environmental Center,Nature Detectives - Fall Thursdays,Nature Detectives - Fall Thursdays,"Sep 25  -  Dec 11, 2025, 3:45 pm - 4:45 pm","Sheldrake, NY, "
58,Sheldrake Environmental Center,Volunteer Cleanup at Sheldrake,Volunteer Cleanup at Sheldrake,"September 27, 2025","Sheldrake, NY, "
59,Sheldrake Environmental Center,Forest Friends - Fall Tuesdays,Forest Friends - Fall Tuesdays,"Sep 30  -  Dec 9, 2025, 3:45 pm - 4:45 pm","Sheldrake, NY, "
60,Sheldrake Environmental Center,Nature Detectives - Fall Tuesdays,Nature Detectives - Fall Tuesdays,"Sep 30  -  Dec 9, 2025, 3:45 pm - 4:45 pm","Sheldrake, NY, "
61,Sheldrake Environmental Center,Mindfulness in Nature - Free Trial,Mindfulness in Nature - Free Trial,"October 1, 2025","Sheldrake, NY, "
62,Sheldrake Environmental Center,Forest Friends - Fall Wednesdays,Forest Friends - Fall Wednesdays,"Oct 1  -  Dec 10, 2025, 3:45 pm - 4:45 pm","Sheldrake, NY, "
63,Sheldrake Environmental Center,Nature Detectives - Fall Wednesdays,Nature Detectives - Fall Wednesdays,"Oct 1  -  Dec 10, 2025, 3:45 pm - 4:45 pm","Sheldrake, NY, "
64,Sheldrake Environmental Center,Home Sweet Habitats,Home Sweet Habitats,"Oct 7  -  28, 2025, 3:45 pm - 4:45 pm","Sheldrake, NY, "
65,Sheldrake Environmental Center,Nature Meditations,Nature Meditations,"October 10, 2025","Sheldrake, NY, "
66,Sheldrake Environmental Center,Mindfulness in Nature - All in for Fall,Mindfulness in Nature - All in for Fall,"Oct 15  -  Nov 19, 2025, 10:00 am - 11:30 am","Sheldrake, NY, "
67,Sheldrake Environmental Center,Wings in the Woods: Fall Birding with Doug Bloom,Wings in the Woods: Fall Birding with Doug Bloom,"November 15, 2025","Sheldrake, NY, "
68,Town of Mamaroneck,Coastal Zone Management Commission Meeting ,"Event date: August 25, 2025  Event Time: 07:30 PM - 11:59 PM Location:  740 West Boston Post Road 1st Floor Mamaroneck, NY 10543"," August 25, 2025  07:30 PM - 11:59 PM",
69,Village of Mamaroneck,Marine Education Center Long Island Sound Marine Explorers Camp,,,
70,Village of Mamaroneck,Committee for the Environment Meeting - Cancelled ,,"August 19, 2025 - 7:30pm",
71,Village of Mamaroneck,Ethics Board Meeting - Cancelled ,,"August 20, 2025 - 4:30pm",
72,Village of Mamaroneck,Fire Council Meetings @ Volunteers Fire House,,"August 20, 2025 - 7:30pm",
73,Village of Mamaroneck,Marine Education Center Long Island Sound Marine Explorers Camp,,,
74,Village of Mamaroneck,Board of Trustees Legislative Meeting,,"August 25, 2025 - 7:00pm",
75,Village of Mamaroneck,Regatta Conference Room Unavailable,,"August 28, 2025 - 7:00pm",
76,Village of Mamaroneck,Labor Day - Non-Emergency Village Offices Closed,,"September 1, 2025 (All day)",
77,Village of Mamaroneck,2025 Beach Season Ends ,,"September 1, 2025 - 5:30pm",
78,Village of Mamaroneck,RESCHEDULED: Arts Council Meeting,,"September 1, 2025 - 7:00pm",
79,Village of Mamaroneck,Fire Council Meetings @ Volunteers Fire House,,"September 1, 2025 - 7:30pm",
80,Village of Mamaroneck,Budget Committee Meeting,,"September 2, 2025 - 7:00pm",
81,Village of Mamaroneck,Board of Architectural Review Meeting,,"September 2, 2025 - 7:30pm",
82,Village of Mamaroneck,Parks & Recreation Commission Meeting,,"September 3, 2025 - 7:00pm",
83,Village of Mamaroneck,NEW: Arts Council Meeting,,"September 4, 2025 - 7:00pm",
84,Village of Mamaroneck,Zoning Board of Appeals Meeting,,"September 4, 2025 - 7:30pm",
85,Village of Mamaroneck,Family Camp Out,,"September 6, 2025 - 5:00pm",
86,Village of Mamaroneck,Board of Trustees Work Session ,,"September 8, 2025 - 5:30pm",
87,Village of Mamaroneck,Planning Board Meeting,,"September 10, 2025 - 7:00pm",
88,Village of Mamaroneck,Tree Committee Meeting,,"September 10, 2025 - 7:30pm",
